Flow ID,Source IP,Source Port,Destination IP,Destination Port,Protocol,Timestamp,Flow Duration,Total Fwd Packets,Total Backward Packets,Total Length of Fwd Packets,Total Length of Bwd Packets,Fwd Packet Length Max,Fwd Packet Length Min,Fwd Packet Length Mean,Fwd Packet Length Std,Bwd Packet Length Max,Bwd Packet Length Min,Bwd Packet Length Mean,Bwd Packet Length Std,Flow Bytes/s,Flow Packets/s,Flow IAT Mean,Flow IAT Std,Flow IAT Max,Flow IAT Min,Fwd IAT Total,Fwd IAT Mean,Fwd IAT Std,Fwd IAT Max,Fwd IAT Min,Bwd IAT Total,Bwd IAT Mean,Bwd IAT Std,Bwd IAT Max,Bwd IAT Min,Fwd PSH Flags,Bwd PSH Flags,Fwd URG Flags,Bwd URG Flags,Fwd Header Length,Bwd Header Length,Fwd Packets/s,Bwd Packets/s,Min Packet Length,Max Packet Length,Packet Length Mean,Packet Length Std,Packet Length Variance,FIN Flag Count,SYN Flag Count,RST Flag Count,PSH Flag Count,ACK Flag Count,URG Flag Count,CWE Flag Count,ECE Flag Count,Down/Up Ratio,Average Packet Size,Avg Fwd Segment Size,Avg Bwd Segment Size,Fwd Header Length.1,Fwd Avg Bytes/Bulk,Fwd Avg Packets/Bulk,Fwd Avg Bulk Rate,Bwd Avg Bytes/Bulk,Bwd Avg Packets/Bulk,Bwd Avg Bulk Rate,Subflow Fwd Packets,Subflow Fwd Bytes,Subflow Bwd Packets,Subflow Bwd Bytes,Init_Win_bytes_forward,Init_Win_bytes_backward,act_data_pkt_fwd,min_seg_size_forward,Active Mean,Active Std,Active Max,Active Min,Idle Mean,Idle Std,Idle Max,Idle Min,Info,Payload Content
10.10.116.200-52.168.117.175-31057-443-6,52.168.117.175,443,10.10.116.200,31057,6,2026-02-26 15:36:02,1,1,0,60,0,60,60,60.0,0,0,0,0,0,60000000.0,1000000.0,0,0,0,0,0,0,0,0,0,0,0,0,0,0,0,0,0,0,40,0,1000000.0,0.0,60,60,60.0,0,0,0,0,0,0,1,0,0,0,0.0,60.0,60.0,0,40,0,0,0,0,0,0,1,60,0,0,16385,-1,1,60,0,0,0,0,0,0,0,0,TLS 443 -> 31057 [ACK] Seq=811141342 Ack=521119937 Win=16385 Len=6,TLS: Encrypted application data
10.10.114.238-224.0.0.251-5353-5353-17,10.10.114.238,5353,224.0.0.251,5353,17,2026-02-26 15:36:02,12073348,16,0,3057,0,310,100,191.0625,68.18033876235876,0,0,0,0,253.2023419284772,1.3252330621052126,0.8048898696899414,1.0170336101226414,3.949396848678589,0.0183870792388916,12.073348045349121,0.8048898696899414,1.0170336101226414,3.949396848678589,0.0183870792388916,0,0,0,0,0,0,0,0,0,448,0,1.3252330621052126,0.0,100,310,191.0625,68.18033876235876,4648.55859375,0,0,0,0,0,0,0,0,0.0,191.0625,191.0625,0,448,0,0,0,0,0,0,16,3057,0,0,-1,-1,16,100,0.0027942657470703125,0,0.0027942657470703125,0.0027942657470703125,2.10297554731369,1.1695576957814708,3.9521753787994385,1.017219066619873,MDNS Standard query response 0x0 ?,DNS Response: f631b401-902c-4d80-b859-19c3ebcdd19a.local -> fe80::1c63:8e0e:bbb6:e716; f631b401-902c-4d80-b859-19c3ebcdd19a.local -> 10.10.114.238
10.10.116.200-104.18.32.47-64882-443-17,10.10.116.200,64882,104.18.32.47,443,17,2026-02-26 15:36:02,13413544,27,21,27412,3178,1292,86,1015.2592592592592,457.62726160316794,668,65,151.33333333333334,207.09425811941705,2280.5306310459287,3.578472386080568,0.5817058915677278,2.6103364967395524,12.837438106536865,0.0,13.41354489326477,0.5159055728178757,2.4588466702746166,12.804992914199829,3.2901763916015625e-05,13.344926118850708,0.6672463059425354,2.792708265996322,12.837438106536865,0.0,0,0,0,0,756,588,2.0128907171703196,1.5655816689102484,65,1292,637.2916666666666,565.8977733924702,320240.2899305555,0,0,0,0,0,0,0,0,0.7777777777777778,637.2916666666666,1015.2592592592592,151.33333333333334,756,0,0,0,0,0,0,27,27412,21,3178,-1,-1,27,65,0,0,0,0,12.807674884796143,0,12.807674884796143,12.807674884796143,UDP 64882 -> 443 Len=1258,
10.10.116.200-162.159.136.234-30284-443-6,162.159.136.234,443,10.10.116.200,30284,6,2026-02-26 15:36:02,18340842,59,44,18057,4558,1099,60,306.0508474576271,243.35065191492174,1454,54,103.5909090909091,220.5429579038781,1233.0404454390546,5.615881754597507,0.36176010877779213,0.564975559022821,3.4417150020599365,0.0,18.3408420085907,0.31622141394121894,0.5486000318212001,3.4417150020599365,0.0,18.19692897796631,0.4231843948364258,0.5807097610508171,3.3265528678894043,0.0,59,59,0,0,2360,1760,3.216864306031582,2.3990174485659255,54,1454,219.5631067961165,254.4208221734148,64729.95475539635,0,0,0,59,103,0,0,0,0.7457627118644068,219.5631067961165,306.0508474576271,103.5909090909091,2360,0,0,0,0,0,0,59,18057,44,4558,19,8257,59,54,0.0013033151626586914,0.0010406493515191346,0.0032150745391845703,3.743171691894531e-05,1.607721710205078,0.8610644495256641,3.3289742469787598,1.1291043758392334,"TLSv1.x Application Data, 443 -> 30284 [ACK, PSH] Seq=2591415407 Ack=3825508064 Win=19 Len=102",TLS: ApplicationData (encrypted)
10.10.116.151-224.0.0.251-5353-5353-17,10.10.116.151,5353,224.0.0.251,5353,17,2026-02-26 15:36:02,1,1,0,78,0,78,78,78.0,0,0,0,0,0,78000000.0,1000000.0,0,0,0,0,0,0,0,0,0,0,0,0,0,0,0,0,0,0,28,0,1000000.0,0.0,78,78,78.0,0,0,0,0,0,0,0,0,0,0,0.0,78.0,78.0,0,28,0,0,0,0,0,0,1,78,0,0,-1,-1,1,78,0,0,0,0,0,0,0,0,MDNS Standard query 0x0 PTR _rdlink._tcp.local.,DNS Query: _rdlink._tcp.local
10.10.116.228-224.0.0.251-5353-5353-17,10.10.116.228,5353,224.0.0.251,5353,17,2026-02-26 15:36:02,5670448,2,0,183,0,96,87,91.5,4.5,0,0,0,0,32.27258197387668,0.35270581392214956,5.670448064804077,0,5.670448064804077,5.670448064804077,5.670448064804077,5.670448064804077,0,5.670448064804077,5.670448064804077,0,0,0,0,0,0,0,0,0,56,0,0.35270581392214956,0.0,87,96,91.5,4.5,20.25,0,0,0,0,0,0,0,0,0.0,91.5,91.5,0,56,0,0,0,0,0,0,2,183,0,0,-1,-1,2,87,0,0,0,0,5.6710205078125,0,5.6710205078125,5.6710205078125,MDNS Standard query 0x0 PTR _spotify-connect._tcp.local.,DNS Query: _spotify-connect._tcp.local
10.10.113.101-224.0.0.251-5353-5353-17,10.10.113.101,5353,224.0.0.251,5353,17,2026-02-26 15:36:02,18053913,4,0,328,0,82,82,82.0,0.0,0,0,0,0,18.16780649625744,0.22155861580801758,6.017971038818359,3.911355763445193,11.549324989318848,3.21840500831604,18.053913116455078,6.017971038818359,3.911355763445193,11.549324989318848,3.21840500831604,0,0,0,0,0,0,0,0,0,112,0,0.22155861580801758,0.0,82,82,82.0,0.0,0.0,0,0,0,0,0,0,0,0,0.0,82.0,82.0,0,112,0,0,0,0,0,0,4,328,0,0,-1,-1,4,82,0,0,0,0,6.033830801645915,3.9064032083417777,11.558264255523682,3.2502763271331787,MDNS Standard query 0x0 PTR _googlecast._tcp.local.,DNS Query: _googlecast._tcp.local
10.10.114.246-224.0.0.251-5353-5353-17,10.10.114.246,5353,224.0.0.251,5353,17,2026-02-26 15:36:03,15569366,15,0,3934,0,446,100,262.26666666666665,118.8676948917951,0,0,0,0,252.6756558056182,0.9634303093757685,1.112097637993949,2.1246112214205084,8.62456202507019,0.0004448890686035156,15.569366931915283,1.112097637993949,2.1246112214205084,8.62456202507019,0.0004448890686035156,0,0,0,0,0,0,0,0,0,420,0,0.9634303093757685,0.0,100,446,262.26666666666665,118.8676948917951,14129.52888888889,0,0,0,0,0,0,0,0,0.0,262.26666666666665,262.26666666666665,0,420,0,0,0,0,0,0,15,3934,0,0,-1,-1,15,100,0,0,0,0,3.014715075492859,3.2416521699034564,8.627346277236938,1.0102832317352295,MDNS Standard query response 0x0 ?,"DNS Response: Nhi nehhhh._companion-link._tcp.local -> [b'rpMac=0', b'rpHN=af6a1dd1c03e', b'rpFl=0x10000', b'rpHA=252235278942', b'rpVr=715.2', b'rpAD=74397fa8c5d3', b'rpHI=150bd858b86d', b'rpBA=D7:21:39:DC:D7:2A']; _services._dns-sd._udp.local -> b'_companion-link._tcp.local.'; _companion-link._tcp.local -> b'Nhi nehhhh._companion-link._tcp.local.'"
10.10.116.228-239.255.255.250-59837-1900-17,10.10.116.228,59837,239.255.255.250,1900,17,2026-02-26 15:36:03,1,1,0,167,0,167,167,167.0,0,0,0,0,0,167000000.0,1000000.0,0,0,0,0,0,0,0,0,0,0,0,0,0,0,0,0,0,0,28,0,1000000.0,0.0,167,167,167.0,0,0,0,0,0,0,0,0,0,0,0.0,167.0,167.0,0,28,0,0,0,0,0,0,1,167,0,0,-1,-1,1,167,0,0,0,0,0,0,0,0,UDP 59837 -> 1900 Len=133,SSDP M-SEARCH | ST: urn:dial-multiscreen-org:service:dial:1
10.10.116.200-8.8.8.8-57040-53-17,10.10.116.200,57040,8.8.8.8,53,17,2026-02-26 15:36:03,38326,1,1,84,141,84,84,84.0,0,141,141,141.0,0,5870.538396939442,52.1825635283506,0,0,0,0,0,0,0,0,0,0,0,0,0,0,0,0,0,0,28,28,26.0912817641753,26.0912817641753,84,141,112.5,28.5,812.25,0,0,0,0,0,0,0,0,1.0,112.5,84.0,141.0,28,0,0,0,0,0,0,1,84,1,141,-1,-1,1,84,0,0,0,0,0,0,0,0,DNS Standard query 0x8287 65 www.google-analytics.com.,DNS Query: www.google-analytics.com
10.10.116.200-8.8.8.8-54614-53-17,10.10.116.200,54614,8.8.8.8,53,17,2026-02-26 15:36:03,28302,1,1,84,180,84,84,84.0,0,180,180,180.0,0,9327.899181184082,70.6659028877582,0,0,0,0,0,0,0,0,0,0,0,0,0,0,0,0,0,0,28,28,35.3329514438791,35.3329514438791,84,180,132.0,48.0,2304.0,0,0,0,0,0,0,0,0,1.0,132.0,84.0,180.0,28,0,0,0,0,0,0,1,84,1,180,-1,-1,1,84,0,0,0,0,0,0,0,0,DNS Standard query 0xfe27 A www.google-analytics.com.,DNS Query: www.google-analytics.com
10.10.116.200-142.251.12.138-61761-443-17,10.10.116.200,61761,142.251.12.138,443,17,2026-02-26 15:36:03,239727,8,11,4974,5050,1292,73,621.75,561.1015393848069,1292,63,459.09090909090907,484.13774421325684,41814.06047586654,79.25649930581248,0.019185402814079735,0.03062106269636199,0.09100604057312012,0.0,0.1494770050048828,0.021353857857840403,0.03355422287777404,0.07970690727233887,9.703636169433594e-05,0.17667484283447266,0.017667484283447266,0.0282893688742143,0.09100604057312012,0.0,0,0,0,0,224,308,33.37115760244736,45.88534170336512,63,1292,527.578947368421,524.128581631552,274710.7700831025,0,0,0,0,0,0,0,0,1.375,527.578947368421,621.75,459.09090909090907,224,0,0,0,0,0,0,8,4974,11,5050,-1,-1,8,63,0,0,0,0,0,0,0,0,UDP 61761 -> 443 Len=1258,
10.10.116.179-224.0.0.251-5353-5353-17,10.10.116.179,5353,224.0.0.251,5353,17,2026-02-26 15:36:03,1,1,0,119,0,119,119,119.0,0,0,0,0,0,119000000.0,1000000.0,0,0,0,0,0,0,0,0,0,0,0,0,0,0,0,0,0,0,28,0,1000000.0,0.0,119,119,119.0,0,0,0,0,0,0,0,0,0,0,0.0,119.0,119.0,0,28,0,0,0,0,0,0,1,119,0,0,-1,-1,1,119,0.0011200904846191406,0,0.0011200904846191406,0.0011200904846191406,0,0,0,0,MDNS Standard query 0x195 PTR _googlecast._tcp.local.,DNS Query: _googlecast._tcp.local
10.10.116.200-8.8.8.8-53265-53-17,10.10.116.200,53265,8.8.8.8,53,17,2026-02-26 15:36:03,32405,1,1,77,233,77,77,77.0,0,233,233,233.0,0,9566.384190351464,61.71860767968687,0,0,0,0,0,0,0,0,0,0,0,0,0,0,0,0,0,0,28,28,30.859303839843435,30.859303839843435,77,233,155.0,78.0,6084.0,0,0,0,0,0,0,0,0,1.0,155.0,77.0,233.0,28,0,0,0,0,0,0,1,77,1,233,-1,-1,1,77,0.0021889209747314453,0,0.0021889209747314453,0.0021889209747314453,0,0,0,0,DNS Standard query 0x3876 65 api.datadoghq.com.,DNS Query: api.datadoghq.com
10.10.116.200-8.8.8.8-49617-53-17,10.10.116.200,49617,8.8.8.8,53,17,2026-02-26 15:36:03,29731,1,1,77,197,77,77,77.0,0,197,197,197.0,0,9215.958941788758,67.26977329772816,0,0,0,0,0,0,0,0,0,0,0,0,0,0,0,0,0,0,28,28,33.63488664886408,33.63488664886408,77,197,137.0,60.0,3600.0,0,0,0,0,0,0,0,0,1.0,137.0,77.0,197.0,28,0,0,0,0,0,0,1,77,1,197,-1,-1,1,77,0,0,0,0,0,0,0,0,DNS Standard query 0xc355 A api.datadoghq.com.,DNS Query: api.datadoghq.com
10.10.116.200-185.26.182.94-31020-443-6,10.10.116.200,31020,185.26.182.94,443,6,2026-02-26 15:36:03,218114,2,1,108,60,54,54,54.0,0.0,60,60,60.0,0,770.2389299951794,13.754266607056776,4.9114227294921875e-05,0,4.9114227294921875e-05,4.9114227294921875e-05,4.9114227294921875e-05,4.9114227294921875e-05,0,4.9114227294921875e-05,4.9114227294921875e-05,0,0,0,0,0,0,0,0,0,80,40,9.169511071371184,4.584755535685592,54,60,56.0,2.8284271247461903,8.0,1,0,1,0,3,0,0,0,0.5,56.0,54.0,60.0,80,0,0,0,0,0,0,2,108,1,60,64581,41404,2,54,0,0,0,0,0,0,0,0,"TLS 31020 -> 443 [FIN, ACK] Seq=2089733697 Ack=2133172790 Win=64581 Len=0",TLS: Encrypted application data
10.10.116.200-74.125.24.17-31026-443-6,10.10.116.200,31026,74.125.24.17,443,6,2026-02-26 15:36:03,37093,2,1,108,60,54,54,54.0,0.0,60,60,60.0,0,4529.049266308016,80.87587975550028,0.0370938777923584,0,0.0370938777923584,0.0370938777923584,0.0370938777923584,0.0370938777923584,0,0.0370938777923584,0.0370938777923584,0,0,0,0,0,0,0,0,0,80,40,53.91725317033352,26.95862658516676,54,60,56.0,2.8284271247461903,8.0,2,0,0,0,3,0,0,0,0.5,56.0,54.0,60.0,80,0,0,0,0,0,0,2,108,1,60,509,1047,2,54,0,0,0,0,0,0,0,0,"TLS 31026 -> 443 [FIN, ACK] Seq=1033663304 Ack=1785948364 Win=509 Len=0",TLS: Encrypted application data
10.10.116.200-3.233.158.20-30949-443-6,10.10.116.200,30949,3.233.158.20,443,6,2026-02-26 15:36:03,307089,3,2,1144,368,821,54,381.3333333333333,323.04420062207515,308,60,184.0,124.0,4923.641138236126,16.281882070886656,0.10927963256835938,0.1400884249587897,0.3070340156555176,5.5789947509765625e-05,0.30708980560302734,0.15354490280151367,0.1534891128540039,0.3070340156555176,5.5789947509765625e-05,0.02074909210205078,0.02074909210205078,0,0.02074909210205078,0.02074909210205078,3,3,0,0,120,80,9.769129242531994,6.512752828354663,54,821,302.4,279.48280805802705,78110.64,0,0,0,3,5,0,0,0,0.6666666666666666,302.4,381.3333333333333,184.0,120,0,0,0,0,0,0,3,1144,2,368,512,79,3,54,0,0,0,0,0,0,0,0,"TLSv1.x Application Data, 30949 -> 443 [ACK, PSH] Seq=3483593480 Ack=313528886 Win=512 Len=767",TLS: ApplicationData (encrypted)
10.10.116.200-142.251.10.95-30969-443-6,10.10.116.200,30969,142.251.10.95,443,6,2026-02-26 15:36:03,15096659,2,2,110,132,55,55,55.0,0.0,66,66,66.0,0.0,16.030036649728462,0.26495928346658615,15.048962593078613,0.0006926059722900391,15.049655199050903,15.048269987106323,15.049655199050903,15.049655199050903,0,15.049655199050903,15.049655199050903,15.048269987106323,15.048269987106323,0,15.048269987106323,15.048269987106323,0,0,0,0,80,104,0.13247964173329307,0.13247964173329307,55,66,60.5,5.5,30.25,0,0,0,0,4,0,0,0,1.0,60.5,55.0,66.0,80,0,0,0,0,0,0,2,110,2,132,507,965,2,55,0,0,0,0,15.006002187728882,0,15.006002187728882,15.006002187728882,TLS 30969 -> 443 [ACK] Seq=174451113 Ack=1604221088 Win=507 Len=1,TLS: Encrypted application data
10.10.116.77-224.0.0.251-5353-5353-17,10.10.116.77,5353,224.0.0.251,5353,17,2026-02-26 15:36:03,1,1,0,218,0,218,218,218.0,0,0,0,0,0,218000000.0,1000000.0,0,0,0,0,0,0,0,0,0,0,0,0,0,0,0,0,0,0,28,0,1000000.0,0.0,218,218,218.0,0,0,0,0,0,0,0,0,0,0,0.0,218.0,218.0,0,28,0,0,0,0,0,0,1,218,0,0,-1,-1,1,218,0,0,0,0,0,0,0,0,MDNS Standard query response 0x0 ?,"DNS Response: _companion-link._tcp.local -> b'MAC\xe2\x80\x99s MacBook Pro (2)._companion-link._tcp.local.'; MAC’s MacBook Pro (2)._device-info._tcp.local -> [b'model=MacBookPro15,1', b'osxvers=24', b'ecolor=157,157,160']"
10.10.116.200-172.64.148.235-30831-443-6,172.64.148.235,443,10.10.116.200,30831,6,2026-02-26 15:36:03,12142027,4,3,332,280,134,60,83.0,30.347981810987037,144,54,93.33333333333333,37.60614606978788,50.40344523698296,0.5765099945406548,4.84740424156189,5.8499272545454994,12.013134002685547,0.032186031341552734,12.095126152038574,4.031708717346191,5.643724527056837,12.013134002685547,0.032186031341552734,12.141895055770874,6.070947527885437,5.939830422401428,12.010777950286865,0.1311171054840088,4,4,0,0,160,120,0.3294342825946599,0.24707571194599492,54,144,87.42857142857143,34.03719454133813,1158.530612244898,0,0,0,4,7,0,0,0,0.75,87.42857142857143,83.0,93.33333333333333,160,0,0,0,0,0,0,4,332,3,280,16,510,4,54,0,0,0,0,11.981244802474976,0,11.981244802474976,11.981244802474976,"TLSv1.x Application Data, 443 -> 30831 [ACK, PSH] Seq=3921831647 Ack=1747340186 Win=16 Len=24",TLS: ApplicationData (encrypted)
10.10.116.200-142.251.10.95-30970-443-6,10.10.116.200,30970,142.251.10.95,443,6,2026-02-26 15:36:04,15089272,2,2,110,132,55,55,55.0,0.0,66,66,66.0,0.0,16.03788336165474,0.26508898118437585,15.044845461845398,0.00042831897735595703,15.045273780822754,15.044417142868042,15.045273780822754,15.045273780822754,0,15.045273780822754,15.045273780822754,15.044417142868042,15.044417142868042,0,15.044417142868042,15.044417142868042,0,0,0,0,80,104,0.13254449059218792,0.13254449059218792,55,66,60.5,5.5,30.25,0,0,0,0,4,0,0,0,1.0,60.5,55.0,66.0,80,0,0,0,0,0,0,2,110,2,132,507,920,2,55,0.004316568374633789,0,0.004316568374633789,0.004316568374633789,15.004675149917603,0,15.004675149917603,15.004675149917603,TLS 30970 -> 443 [ACK] Seq=433781504 Ack=3644410432 Win=507 Len=1,TLS: Encrypted application data
10.10.116.200-74.125.68.188-28858-5228-6,10.10.116.200,28858,74.125.68.188,5228,6,2026-02-26 15:36:04,44106,1,1,55,66,55,55,55.0,0,66,66,66.0,0,2743.3905099624853,45.34529768533034,0,0,0,0,0,0,0,0,0,0,0,0,0,0,0,0,0,0,40,52,22.67264884266517,22.67264884266517,55,66,60.5,5.5,30.25,0,0,0,0,2,0,0,0,1.0,60.5,55.0,66.0,40,0,0,0,0,0,0,1,55,1,66,512,1047,1,55,0,0,0,0,0,0,0,0,28858 -> 5228 [ACK] Seq=339053308 Ack=4098748866 Win=512 Len=1,
10.10.116.5-224.0.0.251-5353-5353-17,10.10.116.5,5353,224.0.0.251,5353,17,2026-02-26 15:36:04,1,1,0,83,0,83,83,83.0,0,0,0,0,0,83000000.0,1000000.0,0,0,0,0,0,0,0,0,0,0,0,0,0,0,0,0,0,0,28,0,1000000.0,0.0,83,83,83.0,0,0,0,0,0,0,0,0,0,0,0.0,83.0,83.0,0,28,0,0,0,0,0,0,1,83,0,0,-1,-1,1,83,0,0,0,0,0,0,0,0,MDNS Standard query 0x0 PTR _sleep-proxy._udp.local.,DNS Query: _sleep-proxy._udp.local
10.10.116.200-140.82.112.26-30824-443-6,10.10.116.200,30824,140.82.112.26,443,6,2026-02-26 15:36:05,14595163,2,3,138,205,83,55,69.0,14.0,79,60,68.33333333333333,7.93025150224688,23.500935253559028,0.34257923110144356,9.560095628102621,6.5782669886734695,14.33722996711731,0.2581620216369629,14.33722996711731,14.33722996711731,0,14.33722996711731,14.33722996711731,14.343056917190552,7.171528458595276,6.913366436958313,14.084894895553589,0.2581620216369629,2,2,0,0,80,132,0.13703169244057742,0.20554753866086614,55,83,68.6,10.781465577554844,116.24000000000001,0,0,0,2,5,0,0,0,1.5,68.6,69.0,68.33333333333333,80,0,0,0,0,0,0,2,138,3,205,512,76,2,55,0.0018944740295410156,0,0.0018944740295410156,0.0018944740295410156,14.08849573135376,0,14.08849573135376,14.08849573135376,TLS 30824 -> 443 [ACK] Seq=3203328433 Ack=2387581179 Win=512 Len=1,TLS: Encrypted application data
10.10.116.200-104.18.12.205-31006-443-6,10.10.116.200,31006,104.18.12.205,443,6,2026-02-26 15:36:05,34653,1,1,55,66,55,55,55.0,0,66,66,66.0,0,3491.670283249283,57.71355840081459,0,0,0,0,0,0,0,0,0,0,0,0,0,0,0,0,0,0,40,52,28.856779200407296,28.856779200407296,55,66,60.5,5.5,30.25,0,0,0,0,2,0,0,0,1.0,60.5,55.0,66.0,40,0,0,0,0,0,0,1,55,1,66,514,16,1,55,0.0017218589782714844,0,0.0017218589782714844,0.0017218589782714844,0,0,0,0,TLS 31006 -> 443 [ACK] Seq=3172664886 Ack=2179526491 Win=514 Len=1,TLS: Encrypted application data
10.10.116.200-104.18.12.205-31007-443-6,10.10.116.200,31007,104.18.12.205,443,6,2026-02-26 15:36:05,37161,1,1,55,66,55,55,55.0,0,66,66,66.0,0,3256.092028357874,53.81970294806403,0,0,0,0,0,0,0,0,0,0,0,0,0,0,0,0,0,0,40,52,26.909851474032013,26.909851474032013,55,66,60.5,5.5,30.25,0,0,0,0,2,0,0,0,1.0,60.5,55.0,66.0,40,0,0,0,0,0,0,1,55,1,66,514,16,1,55,0,0,0,0,0,0,0,0,TLS 31007 -> 443 [ACK] Seq=2560387186 Ack=61269366 Win=514 Len=1,TLS: Encrypted application data
0.0.0.0-255.255.255.255-68-67-17,0.0.0.0,68,255.255.255.255,67,17,2026-02-26 15:36:06,1,1,0,364,0,364,364,364.0,0,0,0,0,0,364000000.0,1000000.0,0,0,0,0,0,0,0,0,0,0,0,0,0,0,0,0,0,0,28,0,1000000.0,0.0,364,364,364.0,0,0,0,0,0,0,0,0,0,0,0.0,364.0,364.0,0,28,0,0,0,0,0,0,1,364,0,0,-1,-1,1,364,0,0,0,0,0,0,0,0,DHCP Request - Transaction ID 0x9a715857,DHCP Request | xid=0x9a715857 | client=ac198efa382c
10.10.116.11-224.0.0.251-5353-5353-17,10.10.116.11,5353,224.0.0.251,5353,17,2026-02-26 15:36:06,7603243,8,0,2057,0,565,82,257.125,184.93001209917227,0,0,0,0,270.54244741969137,1.0521825859783815,1.0861775875091553,1.409390944882773,4.183463096618652,0.0006411075592041016,7.603243112564087,1.0861775875091553,1.409390944882773,4.183463096618652,0.0006411075592041016,0,0,0,0,0,0,0,0,0,224,0,1.0521825859783815,0.0,82,565,257.125,184.93001209917227,34199.109375,0,0,0,0,0,0,0,0,0.0,257.125,257.125,0,224,0,0,0,0,0,0,8,2057,0,0,-1,-1,8,82,0.00017881393432617188,0,0.00017881393432617188,0.00017881393432617188,3.0621378421783447,1.1251826286315918,4.1873204708099365,1.936955213546753,MDNS Standard query 0x0 255 Android.local.,DNS Query: Android.local
10.10.116.160-224.0.0.252-57334-5355-17,10.10.116.160,57334,224.0.0.252,5355,17,2026-02-26 15:36:06,1,1,0,75,0,75,75,75.0,0,0,0,0,0,75000000.0,1000000.0,0,0,0,0,0,0,0,0,0,0,0,0,0,0,0,0,0,0,28,0,1000000.0,0.0,75,75,75.0,0,0,0,0,0,0,0,0,0,0,0.0,75.0,75.0,0,28,0,0,0,0,0,0,1,75,0,0,-1,-1,1,75,0,0,0,0,0,0,0,0,UDP 57334 -> 5355 Len=41,UDP Raw: LAPTOP-2SJH1T79
10.10.116.226-224.0.0.251-5353-5353-17,10.10.116.226,5353,224.0.0.251,5353,17,2026-02-26 15:36:07,3993463,3,0,546,0,223,100,182.0,57.982756057296896,0,0,0,0,136.7234389334128,0.7512276864473231,1.9967315196990967,1.0092155933380127,3.0059471130371094,0.987515926361084,3.9934630393981934,1.9967315196990967,1.0092155933380127,3.0059471130371094,0.987515926361084,0,0,0,0,0,0,0,0,0,84,0,0.7512276864473231,0.0,100,223,182.0,57.982756057296896,3362.0,0,0,0,0,0,0,0,0,0.0,182.0,182.0,0,84,0,0,0,0,0,0,3,546,0,0,-1,-1,3,100,0,0,0,0,3.0080270767211914,0,3.0080270767211914,3.0080270767211914,MDNS Standard query 0x0 PTR _companion-link._tcp.local.,DNS Query: _companion-link._tcp.local
10.10.116.200-49.213.95.31-29713-443-6,10.10.116.200,29713,49.213.95.31,443,6,2026-02-26 15:36:08,11621710,4,2,343,205,118,54,85.75,31.751968442917047,114,91,102.5,11.5,47.15312953732574,0.5162751409196249,5.795587003231049,5.739828918167759,11.560637950897217,0.05196785926818848,11.621710062026978,3.8739033540089927,5.399633551365335,11.51013708114624,0.05196785926818848,11.560637950897217,11.560637950897217,0,11.560637950897217,11.560637950897217,4,4,0,0,160,80,0.34418342727974993,0.17209171363987497,54,118,91.33333333333333,27.90260840056993,778.5555555555557,0,0,0,4,6,0,0,0,0.5,91.33333333333333,85.75,102.5,160,0,0,0,0,0,0,4,343,2,205,514,128,4,54,0,0,0,0,11.512981176376343,0,11.512981176376343,11.512981176376343,"TLSv1.x Application Data, 29713 -> 443 [ACK, PSH] Seq=63721523 Ack=3727317983 Win=514 Len=64",TLS: ApplicationData (encrypted)
10.10.116.200-162.159.134.233-30258-443-6,10.10.116.200,30258,162.159.134.233,443,6,2026-02-26 15:36:08,35963,1,1,55,66,55,55,55.0,0,66,66,66.0,0,3364.563670114028,55.61262264651286,0,0,0,0,0,0,0,0,0,0,0,0,0,0,0,0,0,0,40,52,27.80631132325643,27.80631132325643,55,66,60.5,5.5,30.25,0,0,0,0,2,0,0,0,1.0,60.5,55.0,66.0,40,0,0,0,0,0,0,1,55,1,66,509,16,1,55,0.004793882369995117,0,0.004793882369995117,0.004793882369995117,0,0,0,0,TLS 30258 -> 443 [ACK] Seq=2452694055 Ack=115947413 Win=509 Len=1,TLS: Encrypted application data
10.10.116.200-107.167.96.31-30954-443-6,107.167.96.31,443,10.10.116.200,30954,6,2026-02-26 15:36:09,30,2,1,138,54,78,60,69.0,9.0,54,54,54.0,0,6194664.36923077,96791.63076923077,0.0,0,0.0,0.0,0.0,0.0,0,0.0,0.0,0,0,0,0,0,1,1,0,0,80,40,64527.75384615385,32263.876923076925,54,78,64.0,10.198039027185569,104.0,1,0,0,1,3,0,0,0,0.5,64.0,69.0,54.0,80,0,0,0,0,0,0,2,138,1,54,41760,63418,2,54,0.0034034252166748047,0,0.0034034252166748047,0.0034034252166748047,0,0,0,0,"TLSv1.x Application Data, 443 -> 30954 [ACK, PSH] Seq=2215084040 Ack=2358979729 Win=41760 Len=24",TLS: ApplicationData (encrypted)
10.10.116.200-35.186.224.39-30293-443-6,10.10.116.200,30293,35.186.224.39,443,6,2026-02-26 15:36:09,438390,2,2,151,154,97,54,75.5,21.5,94,60,77.0,17.0,695.7275222557174,9.124295373845474,0.39276552200317383,0.045624494552612305,0.43839001655578613,0.3471410274505615,0.43839001655578613,0.43839001655578613,0,0.43839001655578613,0.43839001655578613,0.3471410274505615,0.3471410274505615,0,0.3471410274505615,0.3471410274505615,2,2,0,0,80,80,4.562147686922737,4.562147686922737,54,97,76.25,19.395553614166314,376.1875,0,0,0,2,4,0,0,0,1.0,76.25,75.5,77.0,80,0,0,0,0,0,0,2,151,2,154,510,1043,2,54,0.0013971328735351562,0,0.0013971328735351562,0.0013971328735351562,0,0,0,0,"TLSv1.x Application Data, 30293 -> 443 [ACK, PSH] Seq=1352060050 Ack=1474192605 Win=510 Len=43",TLS: ApplicationData (encrypted)
10.10.116.108-239.255.255.250-45925-1900-17,10.10.116.108,45925,239.255.255.250,1900,17,2026-02-26 15:36:09,4004924,3,0,501,0,167,167,167.0,0.0,0,0,0,0,125.09600497539302,0.7490778741041497,2.0024620294570923,0.002289891242980957,2.0047519207000732,2.0001721382141113,4.004924058914185,2.0024620294570923,0.002289891242980957,2.0047519207000732,2.0001721382141113,0,0,0,0,0,0,0,0,0,84,0,0.7490778741041497,0.0,167,167,167.0,0.0,0.0,0,0,0,0,0,0,0,0,0.0,167.0,167.0,0,84,0,0,0,0,0,0,3,501,0,0,-1,-1,3,167,0,0,0,0,2.004181385040283,0.002624988555908203,2.0068063735961914,2.001556396484375,UDP 45925 -> 1900 Len=133,SSDP M-SEARCH | ST: urn:dial-multiscreen-org:service:dial:1
10.10.116.108-224.0.0.251-5353-5353-17,10.10.116.108,5353,224.0.0.251,5353,17,2026-02-26 15:36:09,3994740,4,0,380,0,119,87,95.0,13.856406460551018,0,0,0,0,95.12506656159256,1.0013164901220268,1.3315803209940593,0.8823419014999222,1.9988000392913818,0.08478689193725586,3.9947409629821777,1.3315803209940593,0.8823419014999222,1.9988000392913818,0.08478689193725586,0,0,0,0,0,0,0,0,0,112,0,1.0013164901220268,0.0,87,119,95.0,13.856406460551018,192.0,0,0,0,0,0,0,0,0,0.0,95.0,95.0,0,112,0,0,0,0,0,0,4,380,0,0,-1,-1,4,87,0,0,0,0,2.0139468908309937,0.10085165500640869,2.1147985458374023,1.913095235824585,MDNS Standard query 0x0 PTR _spotify-connect._tcp.local.,DNS Query: _spotify-connect._tcp.local
10.10.116.108-10.10.255.255-57621-57621-17,10.10.116.108,57621,10.10.255.255,57621,17,2026-02-26 15:36:09,1,1,0,82,0,82,82,82.0,0,0,0,0,0,82000000.0,1000000.0,0,0,0,0,0,0,0,0,0,0,0,0,0,0,0,0,0,0,28,0,1000000.0,0.0,82,82,82.0,0,0,0,0,0,0,0,0,0,0,0.0,82.0,82.0,0,28,0,0,0,0,0,0,1,82,0,0,-1,-1,1,82,0,0,0,0,0,0,0,0,UDP 57621 -> 57621 Len=48,UDP Raw: SpotUdp0()l.........8-[.k-.3a}...Z..jq'd
10.10.116.200-20.44.229.112-31027-443-6,10.10.116.200,31027,20.44.229.112,443,6,2026-02-26 15:36:09,50323,2,1,108,60,54,54,54.0,0.0,60,60,60.0,0,3338.4330885488225,59.61487658122898,0.0503230094909668,0,0.0503230094909668,0.0503230094909668,0.0503230094909668,0.0503230094909668,0,0.0503230094909668,0.0503230094909668,0,0,0,0,0,0,0,0,0,80,40,39.74325105415265,19.871625527076326,54,60,56.0,2.8284271247461903,8.0,2,0,0,0,3,0,0,0,0.5,56.0,54.0,60.0,80,0,0,0,0,0,0,2,108,1,60,512,16386,2,54,0,0,0,0,0,0,0,0,"TLS 31027 -> 443 [FIN, ACK] Seq=3310450598 Ack=3898213787 Win=512 Len=0",TLS: Encrypted application data
10.10.116.200-35.186.224.39-30294-443-6,10.10.116.200,30294,35.186.224.39,443,6,2026-02-26 15:36:09,140127,2,2,151,154,97,54,75.5,21.5,94,60,77.0,17.0,2176.583007083076,28.54535091256493,0.09035384654998779,0.04977405071258545,0.14012789726257324,0.040579795837402344,0.14012789726257324,0.14012789726257324,0,0.14012789726257324,0.14012789726257324,0.040579795837402344,0.040579795837402344,0,0.040579795837402344,0.040579795837402344,2,2,0,0,80,80,14.272675456282466,14.272675456282466,54,97,76.25,19.395553614166314,376.1875,0,0,0,2,4,0,0,0,1.0,76.25,75.5,77.0,80,0,0,0,0,0,0,2,151,2,154,510,1043,2,54,0,0,0,0,0,0,0,0,"TLSv1.x Application Data, 30294 -> 443 [ACK, PSH] Seq=271429363 Ack=1728199092 Win=510 Len=43",TLS: ApplicationData (encrypted)
10.10.116.200-216.239.38.223-30882-443-6,10.10.116.200,30882,216.239.38.223,443,6,2026-02-26 15:36:10,60692,1,1,55,66,55,55,55.0,0,66,66,66.0,0,1993.6706094020687,32.953233213257334,0,0,0,0,0,0,0,0,0,0,0,0,0,0,0,0,0,0,40,52,16.476616606628667,16.476616606628667,55,66,60.5,5.5,30.25,0,0,0,0,2,0,0,0,1.0,60.5,55.0,66.0,40,0,0,0,0,0,0,1,55,1,66,511,11369,1,55,0,0,0,0,0,0,0,0,TLS 30882 -> 443 [ACK] Seq=3257161651 Ack=2739259290 Win=511 Len=1,TLS: Encrypted application data
10.10.116.160-224.0.0.251-5353-5353-17,10.10.116.160,5353,224.0.0.251,5353,17,2026-02-26 15:36:11,9847263,17,0,1262,0,82,70,74.23529411764706,5.734615344448913,0,0,0,0,128.1574369924858,1.7263680101998877,0.6154539436101913,0.9493282916538431,3.4862680435180664,0.00034499168395996094,9.847263097763062,0.6154539436101913,0.9493282916538431,3.4862680435180664,0.00034499168395996094,0,0,0,0,0,0,0,0,0,476,0,1.7263680101998877,0.0,70,82,74.23529411764706,5.734615344448913,32.88581314878893,0,0,0,0,0,0,0,0,0.0,74.23529411764706,74.23529411764706,0,476,0,0,0,0,0,0,17,1262,0,0,-1,-1,17,70,0.0013611316680908203,0,0.0013611316680908203,0.0013611316680908203,2.0422008633613586,0.9119822543390131,3.4905691146850586,1.0047857761383057,MDNS Standard query 0x0 A wpad.local.,DNS Query: wpad.local
10.10.113.239-224.0.0.252-60890-5355-17,10.10.113.239,60890,224.0.0.252,5355,17,2026-02-26 15:36:11,417603,2,0,150,0,75,75,75.0,0.0,0,0,0,0,359.1928082148766,4.789237442865022,0.4176030158996582,0,0.4176030158996582,0.4176030158996582,0.4176030158996582,0.4176030158996582,0,0.4176030158996582,0.4176030158996582,0,0,0,0,0,0,0,0,0,56,0,4.789237442865022,0.0,75,75,75.0,0.0,0.0,0,0,0,0,0,0,0,0,0.0,75.0,75.0,0,56,0,0,0,0,0,0,2,150,0,0,-1,-1,2,75,0,0,0,0,0,0,0,0,UDP 60890 -> 5355 Len=41,UDP Raw: F9...........LAPTOP-P006K74D
10.10.116.200-35.186.224.22-31008-443-6,10.10.116.200,31008,35.186.224.22,443,6,2026-02-26 15:36:11,57473,1,1,55,66,55,55,55.0,0,66,66,66.0,0,2105.3297270389116,34.79883846345308,0,0,0,0,0,0,0,0,0,0,0,0,0,0,0,0,0,0,40,52,17.39941923172654,17.39941923172654,55,66,60.5,5.5,30.25,0,0,0,0,2,0,0,0,1.0,60.5,55.0,66.0,40,0,0,0,0,0,0,1,55,1,66,509,1046,1,55,0,0,0,0,0,0,0,0,TLS 31008 -> 443 [ACK] Seq=1336126236 Ack=941939487 Win=509 Len=1,TLS: Encrypted application data
10.10.116.160-10.10.255.255-137-137-17,10.10.116.160,137,10.10.255.255,137,17,2026-02-26 15:36:11,9077677,8,0,736,0,92,92,92.0,0.0,0,0,0,0,81.07800285760503,0.8812826397565765,1.2968111378805978,2.5334797066898522,7.461609125137329,0.0369720458984375,9.077677965164185,1.2968111378805978,2.5334797066898522,7.461609125137329,0.0369720458984375,0,0,0,0,0,0,0,0,0,224,0,0.8812826397565765,0.0,92,92,92.0,0.0,0.0,0,0,0,0,0,0,0,0,0.0,92.0,92.0,0,224,0,0,0,0,0,0,8,736,0,0,-1,-1,8,92,0,0,0,0,7.464818477630615,0,7.464818477630615,7.464818477630615,UDP 137 -> 137 Len=58,UDP Raw:  FHFAEBEECACACACACACACACACACACAAA.. 
10.10.116.160-224.0.0.252-56936-5355-17,10.10.116.160,56936,224.0.0.252,5355,17,2026-02-26 15:36:11,405098,2,0,128,0,64,64,64.0,0.0,0,0,0,0,315.97221130145937,4.937065801585303,0.40509891510009766,0,0.40509891510009766,0.40509891510009766,0.40509891510009766,0.40509891510009766,0,0.40509891510009766,0.40509891510009766,0,0,0,0,0,0,0,0,0,56,0,4.937065801585303,0.0,64,64,64.0,0.0,0.0,0,0,0,0,0,0,0,0,0.0,64.0,64.0,0,56,0,0,0,0,0,0,2,128,0,0,-1,-1,2,64,0,0,0,0,0,0,0,0,UDP 56936 -> 5355 Len=30,
10.10.114.239-10.10.255.255-137-137-17,10.10.114.239,137,10.10.255.255,137,17,2026-02-26 15:36:11,1535952,3,0,330,0,110,110,110.0,0.0,0,0,0,0,214.8503512668627,1.9531850115169336,0.7679764032363892,0.06716644763946533,0.8351428508758545,0.7008099555969238,1.5359528064727783,0.7679764032363892,0.06716644763946533,0.8351428508758545,0.7008099555969238,0,0,0,0,0,0,0,0,0,84,0,1.9531850115169336,0.0,110,110,110.0,0.0,0.0,0,0,0,0,0,0,0,0,0.0,110.0,110.0,0,84,0,0,0,0,0,0,3,330,0,0,-1,-1,3,110,0.003016233444213867,0,0.003016233444213867,0.003016233444213867,0,0,0,0,UDP 137 -> 137 Len=76,UDP Raw: E.@......... ENEBEDCNEBEBDEEEDDDDCACACACACAAA.. ..... ........`...r
10.10.116.160-224.0.0.252-60264-5355-17,10.10.116.160,60264,224.0.0.252,5355,17,2026-02-26 15:36:11,411598,2,0,128,0,64,64,64.0,0.0,0,0,0,0,310.98235083884055,4.8590992318568835,0.41159892082214355,0,0.41159892082214355,0.41159892082214355,0.41159892082214355,0.41159892082214355,0,0.41159892082214355,0.41159892082214355,0,0,0,0,0,0,0,0,0,56,0,4.8590992318568835,0.0,64,64,64.0,0.0,0.0,0,0,0,0,0,0,0,0,0.0,64.0,64.0,0,56,0,0,0,0,0,0,2,128,0,0,-1,-1,2,64,0,0,0,0,0,0,0,0,UDP 60264 -> 5355 Len=30,
10.10.116.200-8.8.4.4-60012-443-17,10.10.116.200,60012,8.8.4.4,443,17,2026-02-26 15:36:11,138103,5,6,725,1454,248,75,145.0,84.1023186362897,620,64,242.33333333333334,250.13507462080472,15777.96878031938,79.65014069917997,0.01878486739264594,0.02710511553585241,0.0676579475402832,0.0,0.09724092483520508,0.02431023120880127,0.026958127663550786,0.0676579475402832,0.0001399517059326172,0.0718228816986084,0.01436457633972168,0.02640230883556828,0.06711196899414062,0.0,0,0,0,0,140,168,36.20460940871817,43.4455312904618,64,620,198.0909090909091,199.22780681487328,39691.71900826447,0,0,0,0,0,0,0,0,1.2,198.0909090909091,145.0,242.33333333333334,140,0,0,0,0,0,0,5,725,6,1454,-1,-1,5,64,0,0,0,0,0,0,0,0,UDP 60012 -> 443 Len=214,
10.10.116.200-35.186.224.22-49304-443-17,10.10.116.200,49304,35.186.224.22,443,17,2026-02-26 15:36:11,223870,14,8,15129,595,1292,74,1080.642857142857,431.3979944225943,135,65,74.375,22.95069443393816,70237.1789954834,98.27130106211108,0.01628146171569824,0.03252636205189922,0.09834599494934082,0.0,0.152191162109375,0.011707012469951924,0.027972850112583776,0.09046602249145508,2.09808349609375e-05,0.17343807220458984,0.02477686745779855,0.03819088158628852,0.09834599494934082,0.0,0,0,0,0,392,224,62.53628249407069,35.735018568040395,65,1292,714.7272727272727,594.0844890798693,352936.3801652893,0,0,0,0,0,0,0,0,0.5714285714285714,714.7272727272727,1080.642857142857,74.375,392,0,0,0,0,0,0,14,15129,8,595,-1,-1,14,65,0,0,0,0,0,0,0,0,UDP 49304 -> 443 Len=1254,
10.10.116.200-202.83.3.34-31059-443-6,10.10.116.200,31059,202.83.3.34,443,6,2026-02-26 15:36:11,68185,8,7,1600,1462,695,54,200.0,209.4928399731122,551,60,208.85714285714286,183.50588045963352,44907.17771662546,219.9894401532926,0.006437319975632887,0.011870989743057218,0.04605388641357422,0.0,0.02252817153930664,0.003218310219900949,0.0034036582644547146,0.007473945617675781,0.0001652240753173828,0.0611569881439209,0.01019283135732015,0.01629781978818175,0.04605388641357422,0.0,8,8,0,0,332,292,117.3277014150894,102.66173873820321,54,695,204.13333333333333,197.84029473851433,39140.78222222222,0,2,0,8,14,0,0,0,0.875,204.13333333333333,200.0,208.85714285714286,332,0,0,0,0,0,0,8,1600,7,1462,64240,42340,8,54,0,0,0,0,0,0,0,0,TLS 31059 -> 443 [SYN] Seq=1816585792 Ack=0 Win=64240 Len=0,TLS: Encrypted application data
10.10.116.200-14.238.122.89-30550-443-6,10.10.116.200,30550,14.238.122.89,443,6,2026-02-26 15:36:11,28964,75,152,4883,222315,145,54,65.10666666666667,12.3240397417225,1494,60,1462.5986842105262,201.25701229589166,7843881.537205321,7837.04569998683,0.00021967040167914496,0.0008742435566728678,0.008445978164672852,0.0,0.028964996337890625,0.0003914188694309544,0.001248850934668069,0.008445978164672852,1.1920928955078125e-05,0.020460844039916992,0.0001355022784100463,0.000594137143123605,0.0061419010162353516,0.0,20,20,0,0,3668,6080,2589.3322797313317,5247.713420255499,54,1494,1000.8722466960353,677.6723159610863,459239.7678200624,0,0,0,20,227,0,0,0,2.026666666666667,1000.8722466960353,65.10666666666667,1462.5986842105262,3668,0,0,0,0,0,0,75,4883,152,222315,4140,11,75,54,0,0,0,0,0,0,0,0,"TLSv1.x Application Data, 30550 -> 443 [ACK, PSH] Seq=3371064755 Ack=3802154904 Win=4140 Len=91",TLS: ApplicationData (encrypted)
10.10.116.200-202.83.3.23-31058-443-6,202.83.3.23,443,10.10.116.200,31058,6,2026-02-26 15:36:11,10276,4,2,291,108,93,60,72.75,13.808964479641476,54,54,54.0,0.0,38828.03869979815,583.8802811999722,0.0026000142097473145,0.004432067186045439,0.010276079177856445,0.0,0.010276079177856445,0.0034253597259521484,0.0048441901804481165,0.010276079177856445,0.0,0.0001239776611328125,0.0001239776611328125,0,0.0001239776611328125,0.0001239776611328125,2,2,0,0,160,80,389.25352079998146,194.62676039999073,54,93,66.5,14.326548781894402,205.25,2,0,0,2,6,0,0,0,0.5,66.5,72.75,54.0,160,0,0,0,0,0,0,4,291,2,108,22,513,4,54,0,0,0,0,0,0,0,0,"TLSv1.x Application Data, 443 -> 31058 [ACK, PSH] Seq=2833880711 Ack=1373122780 Win=22 Len=39",TLS: ApplicationData (encrypted)
10.10.116.222-224.0.0.252-55989-5355-17,10.10.116.222,55989,224.0.0.252,5355,17,2026-02-26 15:36:11,414098,2,0,150,0,75,75,75.0,0.0,0,0,0,0,362.23223903867733,4.8297631871823645,0.41409897804260254,0,0.41409897804260254,0.41409897804260254,0.41409897804260254,0.41409897804260254,0,0.41409897804260254,0.41409897804260254,0,0,0,0,0,0,0,0,0,56,0,4.8297631871823645,0.0,75,75,75.0,0.0,0.0,0,0,0,0,0,0,0,0,0.0,75.0,75.0,0,56,0,0,0,0,0,0,2,150,0,0,-1,-1,2,75,0,0,0,0,0,0,0,0,UDP 55989 -> 5355 Len=41,UDP Raw: DESKTOP-6G6O6KH
10.10.116.200-118.69.17.168-31010-443-6,10.10.116.200,31010,118.69.17.168,443,6,2026-02-26 15:36:13,6495,1,1,55,66,55,55,55.0,0,66,66,66.0,0,18626.983190193056,307.8840196726125,0,0,0,0,0,0,0,0,0,0,0,0,0,0,0,0,0,0,40,52,153.94200983630626,153.94200983630626,55,66,60.5,5.5,30.25,0,0,0,0,2,0,0,0,1.0,60.5,55.0,66.0,40,0,0,0,0,0,0,1,55,1,66,9374,501,1,55,0,0,0,0,0,0,0,0,TLS 31010 -> 443 [ACK] Seq=1154499761 Ack=3792484556 Win=9374 Len=1,TLS: Encrypted application data
10.10.116.200-107.167.96.43-31036-443-6,10.10.116.200,31036,107.167.96.43,443,6,2026-02-26 15:36:13,250088,1,1,55,60,55,55,55.0,0,60,60,60.0,0,459.83642674715355,7.997155247776584,0,0,0,0,0,0,0,0,0,0,0,0,0,0,0,0,0,0,40,40,3.998577623888292,3.998577623888292,55,60,57.5,2.5,6.25,0,0,0,0,2,0,0,0,1.0,57.5,55.0,60.0,40,0,0,0,0,0,0,1,55,1,60,64133,41462,1,55,0,0,0,0,0,0,0,0,TLS 31036 -> 443 [ACK] Seq=868172836 Ack=3086113332 Win=64133 Len=1,TLS: Encrypted application data
10.10.116.200-107.167.110.211-31037-443-6,10.10.116.200,31037,107.167.110.211,443,6,2026-02-26 15:36:14,308914,1,1,55,60,55,55,55.0,0,60,60,60.0,0,372.2708100669685,6.47427495768641,0,0,0,0,0,0,0,0,0,0,0,0,0,0,0,0,0,0,40,40,3.237137478843205,3.237137478843205,55,60,57.5,2.5,6.25,0,0,0,0,2,0,0,0,1.0,57.5,55.0,60.0,40,0,0,0,0,0,0,1,55,1,60,63988,42108,1,55,0,0,0,0,0,0,0,0,TLS 31037 -> 443 [ACK] Seq=1549816677 Ack=4260681530 Win=63988 Len=1,TLS: Encrypted application data
10.10.116.200-107.167.110.211-31038-443-6,10.10.116.200,31038,107.167.110.211,443,6,2026-02-26 15:36:14,311902,1,1,55,66,55,55,55.0,0,66,66,66.0,0,387.9423090447114,6.4122695709869655,0,0,0,0,0,0,0,0,0,0,0,0,0,0,0,0,0,0,40,52,3.2061347854934827,3.2061347854934827,55,66,60.5,5.5,30.25,0,0,0,0,2,0,0,0,1.0,60.5,55.0,66.0,40,0,0,0,0,0,0,1,55,1,66,514,83,1,55,0,0,0,0,0,0,0,0,TLS 31038 -> 443 [ACK] Seq=3092706144 Ack=1316984949 Win=514 Len=1,TLS: Encrypted application data
10.10.116.200-107.167.110.211-31039-443-6,10.10.116.200,31039,107.167.110.211,443,6,2026-02-26 15:36:14,308506,1,1,55,60,55,55,55.0,0,60,60,60.0,0,372.7630582423731,6.482835795519532,0,0,0,0,0,0,0,0,0,0,0,0,0,0,0,0,0,0,40,40,3.241417897759766,3.241417897759766,55,60,57.5,2.5,6.25,0,0,0,0,2,0,0,0,1.0,57.5,55.0,60.0,40,0,0,0,0,0,0,1,55,1,60,65182,41729,1,55,0,0,0,0,0,0,0,0,TLS 31039 -> 443 [ACK] Seq=654921590 Ack=1925626206 Win=65182 Len=1,TLS: Encrypted application data
10.10.116.200-34.54.84.110-29238-443-6,10.10.116.200,29238,34.54.84.110,443,6,2026-02-26 15:36:14,2861814,22,27,2836,18402,521,54,128.9090909090909,133.35424767100906,1466,60,681.5555555555555,681.0194609354711,7421.167076636643,17.122007098370634,0.11984693750422051,0.2784391616359485,1.2632629871368408,0.0,2.8156399726867676,0.13407809393746511,0.2933818963844584,1.257720947265625,2.5987625122070312e-05,2.8171660900115967,0.10835254192352295,0.2652004586754982,1.2632629871368408,0.0,25,25,0,0,880,1080,7.687431758452122,9.434575339918512,54,1466,433.42857142857144,582.3231447383481,339100.2448979591,0,0,0,25,49,0,0,0,1.2272727272727273,433.42857142857144,128.9090909090909,681.5555555555555,880,0,0,0,0,0,0,22,2836,27,18402,512,2030,22,54,0,0,0,0,1.219752550125122,0,1.219752550125122,1.219752550125122,"TLSv1.x Application Data, 29238 -> 443 [ACK, PSH] Seq=1068813952 Ack=850041934 Win=512 Len=45",TLS: ApplicationData (encrypted)
10.10.116.200-107.167.96.44-31040-443-6,10.10.116.200,31040,107.167.96.44,443,6,2026-02-26 15:36:15,251254,1,1,55,60,55,55,55.0,0,60,60,60.0,0,457.70400707510464,7.96006968826269,0,0,0,0,0,0,0,0,0,0,0,0,0,0,0,0,0,0,40,40,3.980034844131345,3.980034844131345,55,60,57.5,2.5,6.25,0,0,0,0,2,0,0,0,1.0,57.5,55.0,60.0,40,0,0,0,0,0,0,1,55,1,60,65340,41734,1,55,0,0,0,0,0,0,0,0,TLS 31040 -> 443 [ACK] Seq=994282059 Ack=3583810661 Win=65340 Len=1,TLS: Encrypted application data
10.10.116.200-107.167.96.44-31041-443-6,10.10.116.200,31041,107.167.96.44,443,6,2026-02-26 15:36:15,253680,1,1,55,66,55,55,55.0,0,66,66,66.0,0,476.9784400927809,7.883941158558362,0,0,0,0,0,0,0,0,0,0,0,0,0,0,0,0,0,0,40,52,3.941970579279181,3.941970579279181,55,66,60.5,5.5,30.25,0,0,0,0,2,0,0,0,1.0,60.5,55.0,66.0,40,0,0,0,0,0,0,1,55,1,66,515,83,1,55,0,0,0,0,0,0,0,0,TLS 31041 -> 443 [ACK] Seq=3917430640 Ack=885810389 Win=515 Len=1,TLS: Encrypted application data
10.10.116.200-103.162.92.182-29723-443-6,10.10.116.200,29723,103.162.92.182,443,6,2026-02-26 15:36:16,15043,1,1,55,66,55,55,55.0,0,66,66,66.0,0,8043.597495839607,132.9520247246216,0,0,0,0,0,0,0,0,0,0,0,0,0,0,0,0,0,0,40,52,66.4760123623108,66.4760123623108,55,66,60.5,5.5,30.25,0,0,0,0,2,0,0,0,1.0,60.5,55.0,66.0,40,0,0,0,0,0,0,1,55,1,66,2061,21,1,55,0,0,0,0,0,0,0,0,TLS 29723 -> 443 [ACK] Seq=3290517762 Ack=3300360578 Win=2061 Len=1,TLS: Encrypted application data
10.10.116.200-107.167.96.31-31043-443-6,10.10.116.200,31043,107.167.96.31,443,6,2026-02-26 15:36:16,251235,1,1,55,60,55,55,55.0,0,60,60,60.0,0,457.7370179167932,7.960643789857273,0,0,0,0,0,0,0,0,0,0,0,0,0,0,0,0,0,0,40,40,3.9803218949286365,3.9803218949286365,55,60,57.5,2.5,6.25,0,0,0,0,2,0,0,0,1.0,57.5,55.0,60.0,40,0,0,0,0,0,0,1,55,1,60,63893,41760,1,55,0,0,0,0,0,0,0,0,TLS 31043 -> 443 [ACK] Seq=1736023005 Ack=2413443368 Win=63893 Len=1,TLS: Encrypted application data
10.10.116.200-35.186.224.22-50398-443-17,10.10.116.200,50398,35.186.224.22,443,17,2026-02-26 15:36:17,210194,6,4,523,351,106,74,87.16666666666667,14.334302292829681,120,70,87.75,20.498475553074673,4158.061310000477,47.57507219680179,0.04024225473403931,0.03315039714174845,0.09959197044372559,0.0006561279296875,0.21019411087036133,0.04203882217407227,0.03665975546549899,0.09959197044372559,0.0006561279296875,0.11174392700195312,0.03724797566731771,0.026005556438788758,0.06648707389831543,0.003309011459350586,0,0,0,0,168,112,28.545043318081074,19.030028878720717,70,120,87.4,17.07161386629864,291.44,0,0,0,0,0,0,0,0,0.6666666666666666,87.4,87.16666666666667,87.75,168,0,0,0,0,0,0,6,523,4,351,-1,-1,6,70,0,0,0,0,0,0,0,0,UDP 50398 -> 443 Len=72,
10.10.116.200-35.186.224.24-51827-443-17,10.10.116.200,51827,35.186.224.24,443,17,2026-02-26 15:36:17,309507,5,5,449,403,113,74,89.8,16.65412861725284,105,66,80.6,15.551205741035002,2752.76371067821,32.30943322392265,0.05730399489402771,0.03521480676135003,0.10684704780578613,0.0021882057189941406,0.2301959991455078,0.05754899978637695,0.037737004049023956,0.09854698181152344,0.0021882057189941406,0.22823596000671387,0.05705899000167847,0.03249559510284198,0.10684704780578613,0.016932964324951172,0,0,0,0,140,140,16.154716611961327,16.154716611961327,66,113,85.2,16.755894485225195,280.76000000000005,0,0,0,0,0,0,0,0,1.0,85.2,89.8,80.6,140,0,0,0,0,0,0,5,449,5,403,-1,-1,5,66,0,0,0,0,0,0,0,0,UDP 51827 -> 443 Len=73,"UDP Raw: W.P..dr=""E.MrR..(....L..<.^J........3T.?..............._M.K(nsbsD"
10.10.116.200-107.167.96.31-31042-443-6,10.10.116.200,31042,107.167.96.31,443,6,2026-02-26 15:36:17,251360,1,1,55,60,55,55,55.0,0,60,60,60.0,0,457.5095135656047,7.956687192445299,0,0,0,0,0,0,0,0,0,0,0,0,0,0,0,0,0,0,40,40,3.9783435962226497,3.9783435962226497,55,60,57.5,2.5,6.25,0,0,0,0,2,0,0,0,1.0,57.5,55.0,60.0,40,0,0,0,0,0,0,1,55,1,60,63453,41760,1,55,0,0,0,0,0,0,0,0,TLS 31042 -> 443 [ACK] Seq=1451629566 Ack=523573611 Win=63453 Len=1,TLS: Encrypted application data
10.10.116.200-8.8.8.8-58300-53-17,10.10.116.200,58300,8.8.8.8,53,17,2026-02-26 15:36:18,39589,1,1,77,141,77,77,77.0,0,141,141,141.0,0,5506.556931989955,50.51887093568766,0,0,0,0,0,0,0,0,0,0,0,0,0,0,0,0,0,0,28,28,25.25943546784383,25.25943546784383,77,141,109.0,32.0,1024.0,0,0,0,0,0,0,0,0,1.0,109.0,77.0,141.0,28,0,0,0,0,0,0,1,77,1,141,-1,-1,1,77,0,0,0,0,0,0,0,0,DNS Standard query 0xced7 A snow.software.com.,DNS Query: snow.software.com
10.10.116.200-52.37.32.106-31060-443-6,10.10.116.200,31060,52.37.32.106,443,6,2026-02-26 15:36:18,656494,7,7,3355,4491,1506,54,479.2857142857143,547.9412675214938,1506,60,641.5714285714286,640.4457949948071,11951.363332093715,21.325399776868725,0.08933409055074056,0.10231628033860675,0.24417901039123535,0.0,0.656494140625,0.10941569010416667,0.1036927156032381,0.24417901039123535,0.0,0.4155149459838867,0.06925249099731445,0.09684276893105846,0.21807193756103516,0.0,5,5,0,0,292,292,10.662699888434362,10.662699888434362,54,1506,560.4285714285714,601.4893080970784,361789.38775510207,0,2,0,5,13,0,0,0,1.0,560.4285714285714,479.2857142857143,641.5714285714286,292,0,0,0,0,0,0,7,3355,7,4491,64240,62727,7,54,0,0,0,0,0,0,0,0,TLS 31060 -> 443 [SYN] Seq=2068209784 Ack=0 Win=64240 Len=0,TLS: Encrypted application data
10.10.116.200-20.205.243.166-31065-443-6,10.10.116.200,31065,20.205.243.166,443,6,2026-02-26 15:36:18,1121731,12,15,3055,7949,1089,54,254.58333333333334,319.00874030171786,1490,60,529.9333333333333,591.8491324278136,9809.829829209428,24.06992051877995,0.08729288101196289,0.10624949197993998,0.3104710578918457,0.0,1.121570110321045,0.10196091912009499,0.12342000939414571,0.3104710578918457,0.0001678466796875,1.0607519149780273,0.07576799392700195,0.0888177068368806,0.2642819881439209,0.0,13,13,0,0,492,612,10.697742452791088,13.37217806598886,54,1490,407.55555555555554,508.4810592876798,258552.98765432092,2,2,1,13,26,0,0,0,1.25,407.55555555555554,254.58333333333334,529.9333333333333,492,0,0,0,0,0,0,12,3055,15,7949,64240,65535,12,54,0.0020685195922851562,0,0.0020685195922851562,0.0020685195922851562,0,0,0,0,TLS 31065 -> 443 [SYN] Seq=2035187821 Ack=0 Win=64240 Len=0,TLS: Encrypted application data
10.10.116.200-20.205.243.166-31066-443-6,10.10.116.200,31066,20.205.243.166,443,6,2026-02-26 15:36:18,1226194,12,15,2774,7865,839,54,231.16666666666666,263.295092160024,1490,60,524.3333333333334,585.3618444081309,8676.435010151596,22.01933877940531,0.09604783058166504,0.11945477190785861,0.3710300922393799,0.0,1.2261948585510254,0.11147225986827504,0.1377003798131385,0.3710300922393799,0.00018596649169921875,1.1750009059906006,0.08392863614218575,0.1012378497966877,0.32271909713745117,0.0,13,13,0,0,492,612,9.786372790846803,12.232965988558504,54,1490,394.037037037037,492.3337080779046,242392.48010973935,2,2,1,13,26,0,0,0,1.25,394.037037037037,231.16666666666666,524.3333333333334,492,0,0,0,0,0,0,12,2774,15,7865,64240,65535,12,54,0,0,0,0,0,0,0,0,TLS 31066 -> 443 [SYN] Seq=2706967450 Ack=0 Win=64240 Len=0,TLS: Encrypted application data
10.10.114.239-224.0.0.251-5353-5353-17,10.10.114.239,5353,224.0.0.251,5353,17,2026-02-26 15:36:18,1747097,5,0,1066,0,296,158,213.2,67.60591690081571,0,0,0,0,610.1546787192987,2.8618887369573107,0.43677449226379395,0.3251762343022894,0.999932050704956,0.24486804008483887,1.7470979690551758,0.43677449226379395,0.3251762343022894,0.999932050704956,0.24486804008483887,0,0,0,0,0,0,0,0,0,140,0,2.8618887369573107,0.0,158,296,213.2,67.60591690081571,4570.5599999999995,0,0,0,0,0,0,0,0,0.0,213.2,213.2,0,140,0,0,0,0,0,0,5,1066,0,0,-1,-1,5,158,0,0,0,0,1.0135464668273926,0,1.0135464668273926,1.0135464668273926,MDNS Standard query 0x0 255 8DD7AF93-F082-4E8B-BE04-98AF0B7375A0._asquic._udp.local.,DNS Query: 8DD7AF93-F082-4E8B-BE04-98AF0B7375A0._asquic._udp.local
10.10.116.187-224.0.0.251-5353-5353-17,10.10.116.187,5353,224.0.0.251,5353,17,2026-02-26 15:36:19,1,1,0,119,0,119,119,119.0,0,0,0,0,0,119000000.0,1000000.0,0,0,0,0,0,0,0,0,0,0,0,0,0,0,0,0,0,0,28,0,1000000.0,0.0,119,119,119.0,0,0,0,0,0,0,0,0,0,0,0.0,119.0,119.0,0,28,0,0,0,0,0,0,1,119,0,0,-1,-1,1,119,0,0,0,0,0,0,0,0,MDNS Standard query 0xe PTR _googlecast._tcp.local.,DNS Query: _googlecast._tcp.local
10.10.116.200-107.167.110.211-31046-443-6,10.10.116.200,31046,107.167.110.211,443,6,2026-02-26 15:36:19,313144,1,1,55,60,55,55,55.0,0,60,60,60.0,0,367.2421036602775,6.386819194091783,0,0,0,0,0,0,0,0,0,0,0,0,0,0,0,0,0,0,40,40,3.1934095970458913,3.1934095970458913,55,60,57.5,2.5,6.25,0,0,0,0,2,0,0,0,1.0,57.5,55.0,60.0,40,0,0,0,0,0,0,1,55,1,60,64616,42108,1,55,0,0,0,0,0,0,0,0,TLS 31046 -> 443 [ACK] Seq=1106630707 Ack=1545193880 Win=64616 Len=1,TLS: Encrypted application data
10.10.116.84-224.0.0.252-55980-5355-17,10.10.116.84,55980,224.0.0.252,5355,17,2026-02-26 15:36:19,402497,2,0,150,0,75,75,75.0,0.0,0,0,0,0,372.67353593631066,4.968980479150809,0.4024970531463623,0,0.4024970531463623,0.4024970531463623,0.4024970531463623,0.4024970531463623,0,0.4024970531463623,0.4024970531463623,0,0,0,0,0,0,0,0,0,56,0,4.968980479150809,0.0,75,75,75.0,0.0,0.0,0,0,0,0,0,0,0,0,0.0,75.0,75.0,0,56,0,0,0,0,0,0,2,150,0,0,-1,-1,2,75,0,0,0,0,0,0,0,0,UDP 55980 -> 5355 Len=41,UDP Raw: LAPTOP-DG1A2VM9
10.10.116.200-107.167.110.211-31047-443-6,10.10.116.200,31047,107.167.110.211,443,6,2026-02-26 15:36:19,314375,1,1,55,60,55,55,55.0,0,60,60,60.0,0,365.8041480735453,6.3618112708442665,0,0,0,0,0,0,0,0,0,0,0,0,0,0,0,0,0,0,40,40,3.1809056354221332,3.1809056354221332,55,60,57.5,2.5,6.25,0,0,0,0,2,0,0,0,1.0,57.5,55.0,60.0,40,0,0,0,0,0,0,1,55,1,60,65182,42108,1,55,0,0,0,0,0,0,0,0,TLS 31047 -> 443 [ACK] Seq=4026693417 Ack=1369216202 Win=65182 Len=1,TLS: Encrypted application data
10.10.116.200-74.125.200.188-30279-5228-6,10.10.116.200,30279,74.125.200.188,5228,6,2026-02-26 15:36:19,42469,1,1,55,66,55,55,55.0,0,66,66,66.0,0,2849.1353633342314,47.093146501392255,0,0,0,0,0,0,0,0,0,0,0,0,0,0,0,0,0,0,40,52,23.546573250696127,23.546573250696127,55,66,60.5,5.5,30.25,0,0,0,0,2,0,0,0,1.0,60.5,55.0,66.0,40,0,0,0,0,0,0,1,55,1,66,510,1047,1,55,0,0,0,0,0,0,0,0,30279 -> 5228 [ACK] Seq=3321176562 Ack=2261432289 Win=510 Len=1,
10.10.116.160-224.0.0.252-56121-5355-17,10.10.116.160,56121,224.0.0.252,5355,17,2026-02-26 15:36:20,411588,2,0,128,0,64,64,64.0,0.0,0,0,0,0,310.9899167539907,4.859217449281105,0.4115889072418213,0,0.4115889072418213,0.4115889072418213,0.4115889072418213,0.4115889072418213,0,0.4115889072418213,0.4115889072418213,0,0,0,0,0,0,0,0,0,56,0,4.859217449281105,0.0,64,64,64.0,0.0,0.0,0,0,0,0,0,0,0,0,0.0,64.0,64.0,0,56,0,0,0,0,0,0,2,128,0,0,-1,-1,2,64,0,0,0,0,0,0,0,0,UDP 56121 -> 5355 Len=30,
10.10.116.160-224.0.0.252-61802-5355-17,10.10.116.160,61802,224.0.0.252,5355,17,2026-02-26 15:36:20,1,1,0,64,0,64,64,64.0,0,0,0,0,0,64000000.0,1000000.0,0,0,0,0,0,0,0,0,0,0,0,0,0,0,0,0,0,0,28,0,1000000.0,0.0,64,64,64.0,0,0,0,0,0,0,0,0,0,0,0.0,64.0,64.0,0,28,0,0,0,0,0,0,1,64,0,0,-1,-1,1,64,0,0,0,0,0,0,0,0,UDP 61802 -> 5355 Len=30,
